title,date,content,X1,Unnamed: 0,segs,keywords
张志军：愿率先同台湾同胞分享大陆发展机遇,2018,中新网上海1月23日电 (记者 缪璐)国务院台湾事务办公室主任张志军一行22日、23日在上海分别与在沪台湾文化经济界人士和台湾师生座谈，了解他们在大陆工作、生活、学习的情况，听取对大陆营商、就业和教学、求学环境的意见和建议。,495,495,中新网 上海 月 23 日电   记者   缪璐 国务院台湾事务办公室 主任 张志军 一行 22 日 23 日 在上海 分别与 在沪 台湾 文化 经济界 人士 台湾 师生 座谈 了解他们 在大陆 工作 生活 学习 的情况 听取 大陆 营商 就业 教学 求学 环境的 意见和建议 张志军 座谈会上 中共 十九 大报告 秉持 两岸一家亲 理念 提出 尊重 台湾 现有 的社会制度 台湾同胞 生活方式 率先 台湾同胞 分享 大陆 发展的 机遇 国台办 将继续 台胞 在大陆 工作 生活 求学 就业 提供 同等待遇 推动 相关政策 的落实 22 日的 座谈会上 多位 在沪 台湾 文化 经济界 人士 两岸 融合 过程中 文化融合 发挥 潜移默化的作用 期待 上海 提供更多 支持 助力 两岸 携手 发展 文化创意产业 上海市 台湾同胞 投资企业 协会会长 李政宏 上海 非常适合 发展 文化创意产业 台商 在这一 领域 具备 优势 去年末 上海 出台 关于加快 本市 文化创意产业 创新发展 若干意见 上海台 协 成立了 文创 工作委员会 希望 能为 台湾 文 创业者 在上海 落地生根 提供 平台 联合 数字 文创 公司董事长 兼总经理 李彦 上海 麦可将 文创园 区 总经理 泰瑞 台湾 文化 经济界 人士 建议 设立 主题性 文创园 区 提供 创业 流程 指引 资金融通 支持 等方式 两岸 青年 文化交流 吸引 更多 台湾 文化 业者 青年 到大陆 参与 文创 产业发展 参与 23 日 座谈 台湾 师生 复旦大学 上海交通大学 同济大学 上海理工大学 高校 复旦大学 外国语言文学学院 副院长 卢丽安 吸引 台湾 高级知识分子 到大陆 高校 任教 有助于 大陆 高等教育 发展 建议 鼓励 各省市 开放 人才 计划 设立 专项 计划 提供 缓冲期 等方式 台湾 教师 在大陆 提供 施展抱负 的平台 机会 上海理工大学 工商管理学 系 本科生 陈圣文 多位 台湾 学生 希望 台生 报考 大陆 研究生 增设 考点 并为 大陆 台生 就业 提供指导 政策支持 吸引 更多 台湾青年 在大陆 工作或 创业 张志军 说 中国已成为 全球第二大经济体 台胞 大陆 发展是 明智的 选择 他同时 鼓励 大陆的 台胞 台生 交往 圈 更快 融入 社会,文化创意产业 上海 经济界 台湾 吸引 文创 上海理工大学 文创园 23 台生 提供 复旦大学 在沪 文化 座谈会上 建议 师生 等方式 求学 在大陆 人士 张志军 在上海 到大陆 多位 大陆 座谈 计划 22 就业
张志军走访看望在京台湾师生,2018,NA,492,492,月 20 日下午 中共中央台办 国务院台办 主任 张志军 赴 中国人民大学 走访调研 看望 在校 台湾 师生 晚上 张志军 在京 高校台 籍 教师 座谈 交流 这是 国务院台办 新春 系列 走访调研 首场 活动 旨在 进一步 贯彻落实 党的十九大 精神 倾听 在大陆 台湾同胞 心声 了解他们 学习工作 生活中的 实际困难 需求 研究 出台 新的 政策措施 台湾同胞 在大陆 学习 创业 就业 生活 提供 同等待遇 创造条件 室外 寒风刺骨 屋里 暖意融融 笑声 阵阵 张志军 人民大学 党委书记 靳诺 一同 走进 国际关系学院 2015 级 台湾 同学 杨思婷 大陆 同学 同住 的宿舍 查看 生活 服务设施 仔细 询问 生活上 有什么困难 学习成绩 大陆 学生共同 学习生活 情况 在与 张志军 座谈 互动 中 台湾 学生 踊跃发言 讲述 选择 就读 人民大学 的原因 在校学习 生活和 参加 实习的 丰富多彩 大陆 同学交流 融合的 感受 都表示 人民大学 读书 完全正确 的选择 收获 丰硕 引以为荣 台湾 教师 林承 铎 分享了 自己在 大陆的 读书 求职 经验 并用 习近平总书记 打铁还需自身硬 勉励 学弟学妹 参加 座谈 台湾 学生 表达了 希望 毕业后 在大陆 发展事业 的意愿 据了解 目前在 北京高校 就读 短期 交换 台湾 学生 超过 2500 在京 高校 工作 台湾 教师 49 当晚 张志军 邀请 部分教师 座谈 听取 他们在 大陆 工作 生活的 感想 意见建议 勉励 立足本职 工作 理想 抱负 中华民族伟大复兴 培养 优秀人才 张志军 国台办 台办 进一步加强 台胞 的联系 对他们 在大陆 学习工作 生活 给予 更多 关心 努力 多措施 帮助他们 解决实际问题 希望 台湾同胞 能够在 感受到 两岸 一家人 两岸一家亲 希望他们 不仅在 事业 学业 收获 也能够 通过努力 两岸关系 和平发展 作出贡献,人民大学 张志军 座谈 教师 读书 收获 走访调研 学生 学习工作 同学 勉励 在大陆 台湾 工作 生活 就读 在京 立足本职 有什么困难 并用 靳诺 高校台 室外 解决实际问题 通过努力 寒风刺骨 感想 中国人民大学 杨思婷 的宿舍
国台办：回顾2017 展望2018 完全有信心有能力推动两岸关系继续克难前行,2018,在1月17日的国台办例行新闻发布会上，国台办发言人马晓光首先总结了2017年的两岸关系发展，并展望2018年的两岸关系。,279,279,月 17 日的 国台办 例行 新闻发布会上 国台办 发言人 马晓光 总结了 2017 年的 两岸关系 发展 展望 2018 年的 两岸关系 马晓光 指出 2017 年 两岸关系 形势 严峻 台湾当局 拒不接受 九二共识 放任 纵容 去中国化 渐进 台独 活动 阻挠 两岸 交流合作 台独 势力 鼓噪 公投 修宪 挑动 两岸 敌意 破坏 两岸关系 和平发展 威胁 台海 和平稳定 损害 台湾同胞 利益   马晓光 面对 严峻 局势 深入贯彻 习近平总书记 对台工作 重要思想 全面落实 中央 决策部署 牢牢把握 两岸关系 发展 正确方向 努力 维护 台海 和平稳定 增进 两岸同胞 亲情 福祉 马晓光 一个中国原则 九二共识 采取有力措施 坚决反对 遏制 形形色色 台独 分裂 行径 加强与 岛内 认同 九二共识 支持 两岸关系 和平发展 政党 团体 人士 的交流 对话 团结 两岸同胞 共同维护 台海 和平稳定 马晓光 台湾同胞 办好事 做实事 出台 20 多项 政策措施 招收 台湾 学生 规模 放宽 入学 标准 增设 奖学金 台胞 在大陆 就业 的行业 地域 增开 职业资格考试 项目 开放 申请 国家社科基金 大陆 律师 职业资格 台湾 居民 执业范围 200 多个 火车站 全国所有 民航机场 增设 识别卡 式 台胞证 自助 购取 票机 解决 台胞 在大陆 缴存 和使用 住房公积金 台湾青年 提供 各类 实习 就业 岗位 逾 1.2 万个 两岸 青年创业 基地 就业创业 示范点 累计 入驻 服务台 企及 团队 1400 多个 马晓光 持续深化 两岸经济 合作 习近平总书记 致信 祝贺 全国 台企 联 成立 10 周年 充分体现了 台商 高度重视 深情 关怀 坚定了 台商 扎根 大陆 发展 的信心 举办 大陆 台企 产品 展销会 展示 台商 台企 三十多年 在大陆 发展历程 成果 推动 台商 走 电商 协助 台企 拓展 大陆 内销市场 设立 广西 四川 海峡两岸 产业 合作区 台商 台企 中西部 发展 参与 一带一路 建设 搭建 平台 一批 台湾 大企业 项目投资 建设 新进展 两岸 农业 金融领域 合作 持续 2017 年 两岸 贸易额 1993.9 亿美元 同比增长 11.3% 再创历史新高 大陆 实际使用 台资 含 第三地 47.3 亿美元 同比增长 30.9% 马晓光 推动 两岸 各领域 交流 举办 第九届 海峡论坛 2017 两岸 企业家 紫金山 峰会 中华民族 抗日战争史 研讨会 第三届 两岸 媒体 北京 峰会 两岸同胞 纪念 两岸 交流 30 周年 基层 交流 亮点 频出 青年 交流 创新发展 文化 教育 婚姻 体育 宗教 民间信仰 工会 农渔 少数民族 交流 精彩纷呈 大陆 影视节目 综艺节目 网络文学 网上购物 移动支付 共享服务 岛内 民众 青年人 追捧 首届 海峡两岸 学生 棒球 联赛 广 受关注 总决赛 期间 天的 网络 点击量 就达 5.3 亿次 福建 湄洲 祖庙 妈祖神 赴台 巡游 轰动 全岛 500 万 信众 朝拜 两岸 人员 往来 络绎不绝 2017 年 878 万人次 台湾 居民 大陆 587 万人次 同比增长 2.49% 再创历史新高 展望 2018 年 马晓光 两岸关系 面临的 因素 增多 风险 挑战 增大 我们完全有信心 有能力 应对挑战 把握 方向 推动 两岸关系 克难 前行 马晓光 我们将 深入贯彻 习近平 新时代中国特色社会主义思想 党的十九大 精神 全面落实 中央 对台 大政方针 和工作 决策部署 一个中国原则 九二共识 坚决反对 遏制 任何形式 台独 分裂 两岸经济 文化交流 合作 持续深化 两岸 经济社会 融合 发展 秉持 两岸一家亲 理念 率先 台湾同胞 分享 大陆 发展的 机遇 为他们 在大陆 学习 创业 就业 生活提供与大陆同胞同等的待遇 推动 两岸同胞 弘扬 中华文化 紧密团结 两岸同胞 推动两岸关系和平发展 推进祖国和平统一进程,马晓光 2017 两岸 台商 两岸关系 同比增长 台企 大陆 再创历史新高 交流 在大陆 展望 发展 增设 深入贯彻 年的 和平稳定 多个 万人次 推动 全面落实 两岸同胞 亿美元 持续深化 台海 九二共识 决策部署 就业 学生 台独
国台办：启用M503航线是大陆内部事务，台湾方面不要借机做文章,2018,在1月17日国台办例行新闻发布会上，有记者提问，针对大陆启用M503北上及三条衔接线，台湾当局声称此举违反2015年两岸达成的有关“共识”，是“单方面”“片面”启用，影响到台湾的飞行安全，请问发言人对此有何评论？,277,277,月 17 日 国台办 例行 新闻发布会上 记者 提问 大陆 启用 M503 北上 三条 衔接 线 台湾当局 声称 此举 违反 2015 年 两岸 达成 共识 单方面 片面 启用 影响到 台湾的 飞行安全 请问 发言人 对此 有何 评论 国台办 发言人 马晓光 应询 M503 航线 北上 运行 及相关 衔接 航线 已于 月 日开始 启用 相关情况 民航局 网站 做了 介绍 此前 书面 回答记者提问 时 也就 必要性 作了 在此 我再 表达 几点 看法 意见 第一 海峡西岸 空域 大陆 长三角 往返 珠三角地区 港澳 东南亚 地区的 空中 交通要道 两岸 空中 直达 航路 该地区 开通 M503 北上 衔接 航线 是为 缓解 该地区 航班 快速增长 压力 保证 飞行安全 减少 航班延误 保障 旅客 权益 亚太地区 航空运输 发展需要 也有利于 改善 两岸 航班 运营 进一步 便利 两岸 人员 往来 符合 两岸同胞 共同利益   该区域 航班 快速增长 交通 流量密度 极高 延误 日趋严重 北上 航线 不开通 严重影响 东南亚 港澳地区 长三角 北上 相关 衔接 线 不启用 始终 制约 A470 航线 航班 分流 据统计 2017 年 香港 去往 上海浦东 航班 中 航班 平均 延误 高达 103 分钟 2016 年 同期增长 5.1% 航路 平均 正点率 仅为 46% 启用 M503 北上 航线 及相关 衔接 航线 有效缓解 现有 航线 流量 压力 M503 航线 位于 台湾海峡 靠近 大陆 一侧 在上海 飞行情报区 设立 启用 这一 航线 大陆 民航 空域 管理的 一项 常规工作 大陆的 内部事务 不涉及 台湾的 航线 航点 不存在 单方面 开通 的问题 第三 2015 年 月 航线 启用前 大陆 充分考虑 台方 关切 台湾 进行了 沟通 在沟通 中 大陆 开启 M503 北上 航线 和相关 衔接 航线 时 事先 台湾 通气 但这 并不意味着 开通 航线 台湾 方面的 同意 即便如此 月 日 大陆 启用 M503 北上 及相关 衔接 航线 前 我们也 向台 作了 通报 台方 声称 大陆 违反 2015 年 达成 的共识 完全不符合 事实 第四 M503 航线 启用 南下 航线 总体 运行 平稳 港澳地区 东南亚 航空公司 参与 发挥了 国际民航 航线 的作用 北上 航线 衔接 线 开通 平均每天 飞行 27 班 充分说明 航线 安全性和可靠性 不存在 影响 台湾 飞行安全 马晓光 并强调 我要 指出 台湾 正确看待 借机 做文章 干扰 破坏 两岸关系,航线 北上 m503 衔接 启用 航班 开通 飞行安全 及相关 东南亚 2015 延误 平均 该地区 快速增长 台方 大陆 港澳地区 空域 航路 空中 运行 压力 不存在 长三角 违反 单方面 作了 达成 声称
国台办：坚决反对美众议院通过所谓“台湾旅行法议案”,2018,在1月17日国台办例行新闻发布会上，有记者提问，我们看到美国联邦众议院日前通过了一个所谓的“台湾旅行法议案”，鼓吹美台所有层级官员要实现互访。想问发言人对此有什么样的回应？,293,293,月 17 日 国台办 例行 新闻发布会上 记者 提问 我们看到 美国联邦 众议院 日前 了一个 所谓的 台湾 旅行 法 议案 鼓吹 美台 层级 官员 要实现 互访 想问 发言人 对此 的回应 国台办 发言人 马晓光 应询 外交部 表达了 立场 我要 强调的是 美方 法案 严重违反 中美 三个 联合公报 确立 一个中国原则 坚决反对 奉劝 台湾 要挟 洋 自重 引火烧身,了一个 议案 层级 想问 的回应 我们看到 众议院 鼓吹 美国联邦 要挟 要实现 严重违反 引火烧身 互访 美台 官员 旅行 确立 法案 奉劝 所谓的 强调的是 表达了 我要 中美 美方 联合公报 外交部 三个 17
国台办：欲以“台湾”名义参加奥运会是不可能得逞的,2018,在1月17日国台办例行新闻发布会上，有记者提问，日前岛内“独”派团体举行记者会，宣布将启动以“台湾”名义申请参加2020年的东京奥运会以及所有的国际体育赛事的“公投”连署，请问发言人对此有何评论？,363,363,月 17 日 国台办 例行 新闻发布会上 记者 提问 日前 岛内 派 团体 记者会 将启动 台湾 名义 申请 参加 2020 年的 东京奥运会 所有的 国际 体育赛事 公投 连署 请问 发言人 对此 有何 评论 国台办 发言人 马晓光 应询 国际奥委会 台湾 参加奥运会 有明确的 奥运 模式 国际体育 组织和 两岸 体育界 人士 的原则 改名 的政治 图谋 注定 是一场 不可能 得逞 闹剧,将启动 连署 所有的 记者会 闹剧 体育赛事 东京奥运会 参加奥运会 有明确的 是一场 改名 国际体育 组织和 体育界 2020 不可能 国际奥委会 名义 模式 奥运 的原则 年的 申请 注定 国际 公投 得逞 17 国台办 团体
国台办：相信有关方面会妥善处理台湾某剧集在大陆播出事件,2018,在1月17日国台办例行新闻发布会上，有记者提问，我们注意到日前有网友举报，台湾艺人林心如主演的电视剧被播出平台暂时下架，对此林心如发表声明称她一直支持两岸和平共处、友好发展，以前不曾未来也不会支持任何“台独”的行为和言论。也有舆论认为，将拿到台湾当局的补贴款项等同于“台独”是过度解读，主要还是看影视剧的内容是否健康。另外还有舆论认为，此事可能是因为商业纠纷所致，呼吁网友应该去抵制真正的“台独”分子，勿枉勿纵。对此，请问发言人怎么看待？而这件事情后续又将如何处理？,415,415,月 17 日 国台办 例行 新闻发布会上 记者 提问 注意到 日前 有网友 举报 台湾 艺人 林心如 主演 的电视剧 播出 平台 暂时 下架 对此 林心如 发表声明 称她 支持 两岸 和平共处 友好 发展 未来 也不会 支持 台独 的行为 言论 有舆论认为 拿到 台湾当局 补贴 款项 等同于 台独 过度 解读 主要还是 影视剧 的内容 健康 另外还 有舆论认为 此事 可能是因为 商业 纠纷 所致 呼吁 网友 应该去 抵制 真正的 台独 分子 勿枉勿纵 对此 请问 发言人 怎么看待 这件事情 后续 又将 如何处理 国台办 发言人 马晓光 应询 注意到了 这件事情 有关方面 客观 评估 妥善处理,林心如 这件事情 有舆论认为 款项 下架 影视剧 应该去 过度 的电视剧 勿枉勿纵 如何处理 和平共处 可能是因为 主要还是 真正的 有网友 称她 主演 另外还 怎么看待 艺人 发表声明 网友 抵制 评估 播出 所致 又将 举报 等同于
张志军发表2018年新年贺词,2017,2018年新年来临之际，中共中央台办、国务院台办主任张志军在2018年第一期《两岸关系》杂志发表了题为《共担民族大义 同写时代新篇》的新年贺词，代表中共中央台办、国务院台办向台湾同胞致以节日的问候和新年的祝福。,479,479,2018 年 新年 来临之际 中共中央台办 国务院台办 主任 张志军 2018 年 第一期 两岸关系 杂志 发表了 题为 共担民族大义   同写 时代 新篇 新年贺词 代表 中共中央台办 国务院台办 台湾同胞 致以 节日的 问候 新年的祝福 共担民族大义   同写 时代 新篇 2018 年 新年贺词 中共中央台办 国务院台办 主任   张志军 值此 2018 年 新年到来之际 我谨代表 中共中央 台湾工作办公室 国务院台湾事务办公室 台湾同胞 致以 新年的祝福 诚挚的 问候 刚刚 过去的 2017 年 台海 形势复杂 严峻 台湾当局 拒不接受 九二共识 阻挠 两岸 交流 放任 纵容 台独 势力 推动 去中国化 渐进 台独 种种 倒行逆施 两岸同胞 坚决反对 面对 严峻形势 一年来 我们以 习近平总书记 对台工作 重要思想 指引 认真贯彻落实 中央 决策部署 扎实 推进各项工作 克难 前行 引领 两岸关系 发展 正确方向 金秋 十月 中共 十九 胜利召开 擘画 决胜 小康社会 建成 现代化强国 的宏伟蓝图 也为 新时代 推动两岸关系和平发展 推进祖国和平统一进程 指明了方向 极大地 鼓舞 激励 台湾同胞 参与到 推动两岸关系和平发展 实现中华民族伟大复兴的 进程 中来 一年来 团结 两岸同胞 一个中国原则 九二共识 坚决反对 遏制 形形色色 台独 分裂 行径 排除 干扰 阻挠 努力 维护 推动两岸关系和平发展 扎实 推进祖国和平统一进程 不断取得 新的进展 一年来 持续 深化 两岸 各领域 各界 交流合作 习近平总书记 致信 祝贺 全国 台企 联 成立 10 周年 充分体现了 台商 高度重视 深情 关怀 俞正声 主席 出席 第九届 海峡论坛 2017 两岸 企业家 紫金山 峰会 第三届 两岸 媒体 北京 峰会 两岸经济 交流合作 持续深化 台商投资 大陆 势头 强劲 两岸 人员 往来 络绎不绝 台湾同胞 大陆 人次 再创历史新高 两岸 人文 青年 交流 创新发展 中华民族 抗日战争史 学术研讨会 中华文化 论坛 弘扬 中华文化 民族精神 交流活动 成功举办 海峡两岸 学生 棒球 联赛 广 受关注 网络 点击量 达 5.3 亿次 一年来 台湾同胞 办好事 做实事 出台 20 多项 政策措施 台湾同胞 在大陆 求学 有了 更多 选择 就业有了 更广 空间 旅行 有了 更大 便利 生活 有了 更优 保障 修订了 台 生在 大陆 学习 的有关规定 扩大招生 规模 台生 增设 奖学金 提供了 逾 万个 实习 和就业 岗位 台湾青年 朋友 投身 大陆 发展 放飞梦想 搭建 宽阔的 舞台 出台 涉及 台胞 社会保险 住房公积金 政策措施 台胞 提供 大陆同胞 同等待遇 展望 2018 年 台海 形势 更趋 严峻 台独 势力 干扰 破坏 两岸关系 的风险 变数 增多 两岸同胞 维护 两岸关系 和平发展 台海 和平稳定 的意志 更加坚定 我们完全有信心 有能力 应对挑战 把握 方向 推动 两岸关系 克难 前行 新的一年里 推动两岸关系和平发展 扎实 推进祖国和平统一进程 的决心 不会改变 两岸关系 和平发展 是一条 维护 台海 和平 通向 和平统一 造福 两岸同胞 正确道路 坚定不移 这条 康庄大道 走下去 更好地 两岸人民 美好生活 的向往 新的一年里 一个中国原则 九二共识 的立场 动摇 体现 一个中国原则 九二共识 明确界定 两岸关系 的根本 性质 确保 两岸关系 和平发展 的关键 一年多来 两岸关系 状况 的变化 表明了 九二共识 关键作用 解铃还须系铃人 回归 九二共识 认同 两岸 同属 一个中国 两岸 对话 协商解决 两岸同胞 关心的 台湾 任何政党 团体 大陆 交往 不会存在 障碍 新的一年里 坚决反对 遏制 台独 分裂 行径 的态度 含糊 台独 损害 国家主权和领土完整 破坏 两岸关系 和平发展 威胁 台海 和平稳定 会给 两岸人民 尤其是 台湾同胞 带来 祸害 绝不容忍 法理 台独 分裂 行径 坐视 渐进 台独 侵蚀 和平统一 的基础 新的一年里 深化 两岸 经济社会 融合 发展 增进 两岸同胞 福祉 亲情的 脚步 停顿 两岸一家亲 率先 台湾同胞 分享 大陆 发展机遇 将继续 研究 出台 政策措施 逐步为台湾同胞在大陆学习 创业 就业 生活提供与大陆同胞同等的待遇 台湾同胞 在大陆 学习工作 生活 更加便利 舒心 我们还 努力 深化 两岸经济 社会 文化交流 合作 实现互利互惠 厚植 利益 情感 纽带 同胞 心灵 契合 诚挚 更多 台湾同胞 搭乘 大陆 发展的 快车 参与到 两岸 经济社会 融合 发展和 中华民族伟大复兴 进程 中来 共圆 中国梦 的过程中 个人和 家庭 的美好 梦想 新的一年 是贯彻 中共 十九 精神的 开局 之年 改革开放 40 年的 祖国大陆 更大 发展 之年 衷心希望 两岸同胞 坚定信心 携手 努力 推动两岸关系和平发展 推进祖国和平统一进程 共同创造 中国人的 美好未来 书写 不负 新时代的 两岸关系 新篇章,新的一年里 一年来 两岸关系 台湾同胞 2018 台独 两岸 有了 台海 扎实 新篇 同写 九二共识 之年 两岸同胞 新年的祝福 推动两岸关系和平发展 新年贺词 大陆 推进祖国和平统一进程 两岸人民 政策措施 参与到 行径 和平发展 努力 出台 中来 时代 克难
