title,date,content,X1,Unnamed: 0,segs,keywords
国台办评东亚奥协决定取消2019年东亚青运会,2018,新华社北京7月25日电（记者陈键兴）国务院台办发言人安峰山25日答记者问时指出，东亚奥协决定取消2019年东亚青年运动会，原因在于台湾一些政治势力和“台独”分子，在民进党当局的纵容下推动所谓“东京奥运正名公投”，公然挑战“奥运模式”，使台中2019年东亚青年运动会面临极大的政治风险和政治干扰。我们历来反对以政治干预体育，对所谓“正名公投”的挑衅，多次表达了坚决反对的立场。国际奥委会也高度关注，并致函中华台北奥委会表明态度。“奥运模式”必须坚持和维护，这是国际体育界的共识。取消台中2019年东亚青年运动会，是东亚奥协作出的正确决定。,177,177,新华社 北京 月 25 日电 记者 陈键 兴 国务院台办 发言人 安峰山 25 日 答记者问 时 指出 东亚 奥协 取消 2019 年 东亚 青年 运动会 原因在于 台湾 政治势力 台独 分子 民进党 当局 纵容 推动 东京 奥运 正名 公投 公然挑战 奥运 模式 台中 2019 年 东亚 青年 运动会 面临 极大的 政治风险 政治 干扰 历来 反对 政治 干预 体育 正名 公投 挑衅 表达了 坚决反对 的立场 国际奥委会 高度关注 致函 中华台北 奥委会 表明态度 奥运 模式 必须坚持 维护 这是 国际 体育界 的共识 取消台 中 2019 年 东亚 青年 运动会 东亚 奥 协作 出的 正确决定 他说 台中市 运动会 承办权 得而复失 原因是 清楚的 根源在于 民进党 当局 一己 政治 私利 罔顾 台湾 运动员 体育界 台湾同胞 的利益 不顾 我们的 一再 提醒 执意 纵容 放任 正名 公投 奥运 模式 发起 挑衅 东亚 奥协 取消 台中市 东亚 青年 运动会 民进党 当局 推动 公投 台独 势力 难逃 其咎 混淆视听 转移视线 无济于事 他们要 对自己的 言行 承担全部 责任 安峰山 指出 一再 规劝 民进党 当局 不要做 挑战 一个中国原则 破坏 两岸关系 损害 台湾同胞 利益 损害 中华民族 利益 的事 置若罔闻 一个时期 民进党 当局 阻挠 两岸 交流 变本加厉 大陆 交流 团组 赴台 一再 禁限 台湾 民间团体 大中学生 大陆 文化体育 交流 屡遭 民进党 当局 打压 恐吓 愿 奉劝 民进党 当局 回到 九二共识 为基础 两岸关系 和平发展道路 不要再 政治 私利 伤害 牺牲 台湾 老百姓 的利益 挑动 两岸同胞 敌意 升高 两岸 对抗 要挟 洋 自重 心存 幻想 执迷不悟 安峰山 一贯 积极支持 和努力 推动 两岸 民间体育 交流 乐见 台湾 奥运 模式 参与 国际 体育活动 两岸 运动 健儿 在国际 赛事 佳绩 都是 中华儿女 荣光 两岸 民间体育 交流 保持良好 发展态势 交流合作 中 推动了 体育运动 普及 体育精神 弘扬 促进了 两岸 竞技运动 水平的 提高 我们将 一如既往 大力支持 包括 体育 交流 在内的 两岸 各领域 交流 不断扩大 深化 两岸关系 和平发展 增添 正能量,东亚 运动会 奥运 模式 当局 民进党 公投 一再 交流 正名 民间体育 台中市 青年 私利 奥协 2019 体育界 两岸 政治 体育 挑衅 取消 国际 纵容 安峰山 的利益 25 台湾 推动 保持良好
刘结一：深入学习习近平党建思想　全面推进对台工作系统党的建设,2018,深入学习习近平党建思想,140,140,学习习近平 党建 思想 全面推进 对台工作 系统 党的建设 刘结 习近平 党建 思想是 马克思主义 党建 学说 发展的 最新 成果 习近平 新时代中国特色社会主义思想 重要组成部分 新时代 全面加强党的领导和党的建设 的根本 对台工作 系统 党的建设 要以 习近平 党建 思想 为指导 始终坚持 和加强 党对 对台工作 领导 以党的政治建设为统领 一以贯之 全面从严治党 推动 对台工作 在新时代 有新气象 新 旗帜鲜明 讲政治 坚决维护 党对 对台工作 领导 党的十九大 报告 明确指出 以党的政治建设为统领 把党的政治建设摆在首位 是关于 新时代 党的建设 新论断 新要求 对台工作 系统 以党的政治建设为统领 这一 根本要求 落实到 对台工作 各方面 牢牢把握 两个 坚决维护 对台工作 系统 主要承担 祖国统一 历史任务 责任重大 使命光荣 坚决维护 习近平总书记 核心地位 坚决维护党中央权威 集中统一 领导 最大的 政治纪律 政治规矩 始终 政治立场 政治方向 政治原则 政治 道路上 同以 习近平同志为核心的党中央 保持高度一致 特别是在 民进党 当局 制造事端 台独 势力 蠢蠢欲动 外部干扰 因素 明显增多 台海 形势 严峻 的情况下 紧紧抓住 政治建设 统领 任何时候 任何情况下 含糊 决不动摇 确保 中央 对台工作 大政方针 决策部署 不折不扣 贯彻执行 习近平 对台工作 重要思想 武装头脑 习近平 对台工作 思想境界高 远 逻辑 缜密 内涵 习近平 新时代中国特色社会主义思想 重要组成部分 新时代 对台工作 行动指南 对台工作 系统要 把学习贯彻 习近平 对台工作 重要思想 思想建设 重中之重 读 原著 学 原文 悟 原理 准确 领会 把握 思想精髓 核心 要义 真正做到 学思用 贯通 知 信行 统一 始终 习近平 对台工作 重要思想 指引 始终保持 强大的 战略 定力 服从 党和国家 工作 全局 安排 严峻复杂 的风险 挑战 面前 啃硬骨头 于涉险滩 克难 前行 推动两岸关系和平发展 推进祖国和平统一进程 营造风清气正的良好政治生态 政治生态 是我们 党 团结 带领 全国各族人民 进行伟大斗争 建设伟大工程 推进伟大事业 实现伟大梦想 必然要求 应对 四大考验 四种危险 有力武器 对台工作 政策性 强 敏感度 高 面临 严峻复杂 形势 增强党内政治生活的政治性 时代性 原则性 战斗性 严格遵守 政治纪律 政治规矩 七个 有之 发生 要紧跟 台海 新形势 党员干部 队伍 新变化 创新 工作方法 及时发现和 解决 党内 出现的问题 要用好 批评和自我批评 武器 党组织 都成为 坚强的 战斗堡垒 每名 党员 都成为 走在前 作表率 的典范 突出政治功能 抓落实 全面提升 对台工作 系统 基层党组织 组织 力 党的基层组织 确保 党的路线方针政策 决策部署 贯彻落实 的基础 党的十九大 党的基层组织 建设 作出了 新 部署 提出了 新目标 明确了 新 定位 制定了 新举措 对台工作 系统 基层党组织 从全局 和战略 高度 以提升 组织 力 为重点 推进 全面从严治党 基层 延伸 让党 的旗帜 在每一个 阵地上 高高飘扬 全面提升 组织 力 基层党组织 的组织 力 强弱 直接关系 党的 工作 影响力 凝聚力 战斗力 体现 党员干部 积极性 主动性 创造性的 强弱 对台工作 系统 各级党组织 要积极 发挥 党的 政治优势 扎实做好 思想政治工作 确保 党的路线方针政策 在基层 落地生根 贯彻党的 对台工作 路线方针政策 变为 党员干部 自觉 对台工作 系统 进一步扩大 党的组织 党的 工作 覆盖面 主管 社会组织 切实做到 两个 全覆盖 要进一步 选准 配强 党组织 带头人 重点 抓住 关键少数 着力解决 好一些 基层 党组织弱化 虚化 边缘化问题 基层党组织 强 密切联系群众 密切联系群众 是我们党的 优良传统 作风 是我们 党 革命 建设和改革 发展胜利 力量源泉 根本保证 也对 深化 两岸同胞 交流合作 和心灵 契合 有重要 指导意义 两岸同胞是命运与共的骨肉兄弟 是血浓于水的一家人 对台工作 系统要 秉持 两岸一家亲 的理念 努力 台湾 民众 尤其是 基层 民众 多做实事 办好事 让更多的 台湾同胞 分享 大陆 发展的 机遇 中 获益 更多的 台湾同胞 参与到 推动两岸关系和平发展 促进两岸 交流合作 历史潮流 中来 要通过 逐步为台湾同胞在大陆学习 创业 就业 生活 提供 大陆同胞 同等待遇 增进台湾同胞福祉 严格落实 组织生活 制度 严肃认真 党内 政治生活 是我们党的 优良传统 政治优势 党组织 教育 管理党员 党员 党性 锻炼 的主要 平台 对台工作 严 标准高 在加强 对台工作 基层党组织建设 打造 过硬 党员干部 队伍 过程中 认真贯彻落实 新形势下 党内 政治 生活的 若干准则 中国共产党 党内监督条例 民主集中制原则 严格执行 三会一课 民主生活会 组织生活 会等 党的组织生活制度 基层党组织 教育 党员的 学校 团结 群众 的核心 攻坚克难 堡垒 好干部 标准 努力打造 一支 高素质 专业化 对台工作 干部队伍 习近平总书记 指出 党要管党 首先是管好干部 从严治党 关键是从严治吏 好干部 要做到 信念 坚定 为民服务 勤政 务实 敢于担当 清正廉洁 对台工作 系统 要认真 领会 落实 习近平总书记 的要求 把好 干部 标准 落到实处 努力建设 一支 对党忠诚 业务 专精 纪律严明 高素质 对台工作 队伍 坚持以 高标准 建设 对台 干部队伍 在坚持 好干部 标准 基础上 对台工作 系统 干部队伍 坚定信念 战略 信心 和战略 定力 贯彻落实 中央 对台 大政方针 要坚持 执政为民 全心全意为人民服务的宗旨 贯彻到 实际工作中 要坚持 勤政 务实 创新 的精神 务实 的态度 深刻 把握 两岸关系 发展规律 研究 新情况 解决新问题 新思路 新举措 不断开创 对台 工作新局面 要坚持 敢于担当 在对 台 各项工作中 真抓实干 领导干部 发挥 引领 带头作用 各级党组织 发挥好 战斗堡垒作用 党员干部 发挥好 先锋模范作用 力戒 无所作为 推诿扯皮 好人主义 要坚持 清正廉洁 在对 台 交往 中 严格遵守 政治纪律 组织纪律 工作纪律 时刻 风清气正 清廉 形象 赢得 台湾同胞 的信任 和支持 对台工作 实践中 锤炼 干部 习近平总书记 好干部 自然而然 成长 好干部 一靠 努力 二靠 组织培养 对台工作 性质 对台 干部 既要 突出政治标准 又要 提高 专业能力 培养 专业精神 特别是在 台海 形势 严峻 风险 挑战 不断增多 的情况下 对台工作 系统 党员干部 更要 改造 主观世界 加强党性修养 品格 陶冶 时刻 党章 严格要求自己 时刻 自重 自省 自警自励 老老实实做 踏踏实实 干事 各级党组织 要教育引导 党员干部 自觉 深入基层 深入实际 深入群众 对台工作 实践中 砥砺 品质 提高 本领 要下 气力 抓好 干部 培养 工作 看得 准 有潜力 有发展前途 年轻干部 要敢于 给他们 压担子 有计划地 安排 他们去 经受锻炼 不断提升 他们的 政治 站位 综合素质 建立 科学有效的 选人用人 机制 习近平总书记 指出 用一 贤人 群贤毕至 见贤思齐 蔚然成风 对台工作 系统 各级党组织 要坚持党管干部原则 正确 用人 导向 坚持德才兼备 以德为先 努力做到 选贤任能 当其时 知人善任 人尽其才 把好 干部 及时发现 合理使用 要在 对台工作 实践中 全面考核 干部 干部 大是大非 问题上 政治立场 名利 得失 上的 境界 格局 在处理 问题时 的能力 担当 考核内容 真正做到 人才 各尽其能 久久 为功 抓 作风 坚定不移 推进 全面从严治党 向纵深发展 习近平总书记 指出 作风问题 根本上 是党性问题 作风 反映的 是形象 素质 体现 的是 党性 决定性作用 的也是 党性 作风问题 抓长 长抓 扭住 不放 持之以恒 久久 为功 对台工作 系统要 坚持以 作风建设 为抓手 持之以恒 正风 肃纪 推动全面从严治党向纵深发展 持续 整治 四风 习近平总书记 抓 四风 徙木立信 的作用 抓就 真抓 一抓到底 对台工作 系统要 群众路线教育 成果 要经常 照镜子 正衣冠 洗洗澡 治治病 自我 净化 自我完善 自我革新 自我提高 四风 新表现 表态 调门 高 少 落实 差等 突出问题 要拿出 过硬措施 扎扎实实 地改 党员领导干部 要带头 认真贯彻落实 中央八项规定精神 率下 层层 示范 节点 节点 抓 一件事 一件事 地做 一个细节 一个细节 落实 监督 执纪 四种形态 着力 抓早抓小 抓苗头 下功夫 进一步提高 监督 执纪 水平 筑牢 拒腐防变 思想防线 习近平总书记 指出 干部 廉洁自律的 关键在于 守住 底线 对台工作 高度 政治性 敏感性 特殊性 对台工作 系统 党员干部 必须要 守住 做人 处事 用权 交友 底线 守住 党和人民 交给 自己的 政治责任 守住 自己的 政治 生命线 守住 正确的 人生观价值观 对台工作 系统 党员干部 清醒 认识到 权力 真空 反腐败 净土 决不能 放松 反腐败斗争 警惕性 对权力 寻租 隐患 腐败的 风险 警钟长鸣 严加防范 扎紧 篱笆 把住 关口 对台工作 系统 要结合 即将开展 不忘初心 牢记使命 主题教育 钉钉子 精神 抓好 党建工作 确保 思想上政治上行动上 同以 习近平同志为核心的党中央 保持高度一致 以时不我待 只争朝夕的精神 状态 奋发有为 攻坚克难 努力 推动两岸关系和平发展 推进祖国和平统一进程 实现中华民族伟大复兴的中国梦 作出新的贡献 作者 系 中共中央 台湾工作办公室 国务院台湾事务办公室 主任,对台工作 系统 党员干部 干部 好干部 守住 基层党组织 系统要 习近平 党建 习近平总书记 各级党组织 四风 党性 干部队伍 作风 实践中 党组织 要坚持 政治纪律 时刻 队伍 以党的政治建设为统领 确保 党内 党的建设 标准 务实 全面从严治党 组织
刘结一寄语两岸青年：你我更亲，两岸更近，中华更强！,2018,新华社北京7月21日电（记者陈键兴）海峡两岸（北京）体育交流运动会（简称“海运会”）乒乓球男子团体和女子团体21日下午进行决赛，中共中央台办、国务院台办主任刘结一出席颁奖并挥拍上阵，与两岸青年选手热情交流。,133,133,新华社 北京 月 21 日电 记者 陈键 兴 海峡两岸 北京 体育 交流 运动会 简称 海运 乒乓球 男子团体 女子团体 21 日下午 决赛 中共中央台办 国务院台办 主任 刘结 出席 颁奖 挥拍 上阵 两岸 青年 选手 热情 交流 刘结 称赞 海运 有创意 更有意义 探索 和实践 一种 两岸 民众 交流 融合的 新形式 4000 多名 两岸 青年学生 基层 民众 踊跃参加 海运 证明 两岸同胞 交流 蕴藏 巨大潜力 拥有 不竭动力 刘结 一以 本届 海运 更亲 更近 更强 主题口号 寄语 两岸 青年 希望大家 比赛 交流 更亲 好朋友 好伙伴 希望 两岸 青年 肩负起 推动两岸关系和平发展 使命 交流 促进心灵契合 两岸 越走越近 希望 两岸 青年 体育 交流 强身健体 在新时代 团结 携手 奋发有为 致力 中华民族伟大复兴 北京市委常委 齐静 一同出席 活动,海运 交流 更亲 青年 两岸 体育 21 刘结 女子团体 挥拍 上阵 新形式 一以 男子团体 更有意义 强身健体 蕴藏 有创意 乒乓球 一同出席 简称 主题口号 北京市委常委 齐静 一种 和实践 好朋友 巨大潜力 更强 寄语
刘结一主任出席第七届两岸和平发展法学论坛,2018,NA,67,67,月 19 日 中共中央 台湾工作办公室 国务院台湾事务办公室 主任 刘结 出席 中国法学会 主办的 第七届 两岸和平 发展 法学论坛 刘结 一在 致辞 中表示 月 13 日 习近平总书记 会见 中国国民党 前主席 连战 率领的 台湾 各界人士 参访团 时 发表的 重要讲话 两岸同胞 台海 形势 把握 两岸关系 发展 主流 大势 在新时代 携手同心 书写 中华民族伟大复兴 新篇章 指导意义 刘结 指出 两岸关系 走近 走好 台湾 才有 前途 台湾同胞 才有 光明 未来 一个中国原则 两岸关系 的政治 基础 两岸同胞 要旗帜鲜明 体现 一个中国原则 九二共识 坚定 反对 遏制 各种形式 台独 分裂活动 以实际行动 捍卫 两岸关系 的政治 基础 两岸 法律界 人士 要积极 发挥 专长 为深化 两岸同胞 交流合作 提供优质 法律服务 保障 传承 中华 法治 文化 优良传统 两岸同胞 心灵 契合 刘结 希望 两岸 法律界 有识之士 坚定 两岸同胞 谋 福祉 为中华民族谋复兴 使命 担当 推动两岸关系和平发展 推进祖国和平统一进程 作出 应有 贡献,法律界 刘结 才有 两岸同胞 两岸关系 的政治 专长 要积极 中国法学会 要旗帜鲜明 坚定 优良传统 基础 第七届 为中华民族谋复兴 法学论坛 中表示 法律服务 发表的 新篇章 提供优质 应有 法治 主办的 主流 有识之士 连战 书写 各种形式 一个中国原则
刘结一主任在第七届两岸和平发展法学论坛开幕式上的致辞,2018,在第七届两岸和平发展法学论坛开幕式上的致辞,79,79,第七届 两岸和平 发展 法学论坛 开幕式 上的 致辞 中共中央台办 国务院台办 主任 刘结 2018 年 月 19 日 尊敬的 王乐泉 会长 陈冀平 书记 尊敬的 苏永钦 理事长 潘维 校长 海峡两岸 专家学者 大家好 很高兴 出席 第七届 两岸和平 发展 法学论坛 我谨代表 中共中央台办 国务院台办 论坛的 热烈祝贺 与会 嘉宾 台湾的 专家学者 致以 诚挚 问候 本届 论坛 两岸 法学 交流合作 回顾与 展望 为主题 回顾 两岸 法学 交流合作 30 年 历程 聚焦 两岸 经济社会 融合 发展中的 法律问题 研讨 深化 两岸 法学 交流合作 重要意义 希望 本届 论坛 为巩固 两岸关系 的政治 基础 凝聚 两岸同胞 的共识 两岸同胞 交流合作 作出 应有 贡献 今年是 祖国大陆 改革开放 40 周年 大陆同胞 历经 长期 努力 不懈奋斗 走上了 中国特色社会主义道路 取得了 举世瞩目 巨大成就 始终坚持 和平统一 一国两制 基本方针 坚决反对 台独 分裂活动 深化 两岸经济 文化交流 合作 保障 两岸同胞 合法权益 推动两岸关系和平发展 推进祖国和平统一进程 在这一 历史进程 中 两岸同胞 包括 法律界 人士 为厚植 两岸 同属 中国的政治 基础 增进 两岸同胞 理解 认同 推动 两岸关系 克难 前行 作出了 积极贡献 中共 十九 确定了 决胜全面建成小康社会 建设社会主义现代化 强国 的宏伟蓝图 明确了 全面推进依法治国 的总 目标 阐述了 推进 新时代 对台工作 发展两岸关系 的指导思想 月 13 日 习近平总书记 会见 中国国民党 前主席 连战 率领的 台湾 各界人士 参访团 时 发表重要讲话 大道之行 人心所向 势不可挡 强调要 坚定不移 九二共识 反对 台独 坚定不移 深化 两岸 交流合作 坚定不移 两岸同胞 谋 福祉 坚定不移 团结 两岸同胞 致力 民族 复兴 这对 两岸同胞 台海 形势 把握 两岸关系 发展 主流 大势 在新时代 携手同心 书写 中华民族伟大复兴 新篇章 指导意义 台海 形势复杂 严峻 两岸同胞 包括 法律界 人士 十分关心 排除 干扰 推动两岸关系和平发展 深化 两岸经济 文化交流 合作 两岸同胞 心灵 契合 我愿 谈 几点 看法 第一 恪守 政治 基础 捍卫 一中 原则 一个中国原则 两岸关系 的政治 基础 体现 一个中国原则 九二共识 确保 两岸关系 和平发展 的关键 中国的主权 领土完整 分裂 两岸 同属 一个中国 的事实 从未改变 也不可能 改变 民进党 当局 拒不承认 九二共识 推行 去中国化 渐进 台独 阻挠 两岸同胞 交流合作 打压 认同 九二共识 反对 台独 支持 祖国统一 政党 团体 人士 放任 纵容 台独 势力 操弄 公投 制宪 挟洋 自重 制造 麻烦 危险的 道路上 越滑越远 图谋 行径 直接威胁 台海 和平稳定 严重危害 两岸关系 损害 中华民族 根本利益 台湾同胞 切身利益 两岸同胞 保持高度警惕 旗帜鲜明地 九二共识 坚定 反对 遏制 各种形式 台独 分裂活动 以实际行动 捍卫 两岸关系 的政治 基础 强化 法治 保障 融合 发展 两岸同胞 血脉相连 骨肉相亲 一家人 共享 机遇 共谋发展 月 出台 促进两岸 经济 文化交流 合作的 31 条 措施 出发点 落脚点 台胞 提供 大陆同胞 同等待遇 台湾同胞 祖国大陆 广阔天地 更好 发展 措施 已经为 台湾同胞 带来 实实在在的 感 省市 陆续 出台 更大 力度的 地方性 措施 赢得 台胞 赞许 我们的 法律服务 市场 扩大开放 越来越多的 台湾 法律界 人士 前来 执业 发展 2008 年 开放 台湾 居民 参加 国家司法考试 共有 3876 人次 参加考试 334 人被 授予 法律 职业资格 许多人 已在 大陆 律师行业 我们在 司法 领域 推出 惠及 台胞 的措施 省市 台商投资区 台湾 农民 创业园 台湾青年 就业创业 基地 设立了 法官 工作室 检察 工作室 司法 服务站 聘任 台胞 担任 调解员 人民陪审员 检察 联络员 社区矫正 监督员 台湾同胞 参与 大陆 法治建设 创造了 更好 条件 祖国大陆 进一步深化改革 扩大开放 台胞 带来 广阔的 发展机遇 前景 我们鼓励 两岸 法律界 人士 发挥 专长 为深化 两岸同胞 交流合作 提供优质 法律服务 保障 第三 弘扬 法治 文化 增进 心灵 契合 中华 法治 文化 源远流长 底蕴 深厚 中华优秀 传统文化 重要组成部分 两岸同胞 共同的 精神财富 以民为本 明德慎罚 讲信修睦 天下为公 中华 传统 法治思想 精髓 两岸 同胞 尊崇 祖国大陆 法治建设 过程中 植根 传统 立足 现实 推进科学立法 严格执法 公正司法 全民守法 加强人权法治保障 人民群众 司法 需求 推进 信息化建设 大数据 等方面 实现了 跨越发展 希望 两岸 法律界 人士 携手同心 传承 中华 法治 文化 优良传统 两岸同胞 心灵 契合 解决台湾问题 实现祖国完全统一 是中华民族根本利益所在 两岸关系 走近 走好 台湾 才有 前途 台湾同胞 才有 光明 未来 希望 两岸 法律界 有识之士 坚定 两岸同胞 谋 福祉 为中华民族谋复兴 使命 担当 推动两岸关系和平发展 推进祖国和平统一进程 作出 应有 贡献 预祝 本届 研讨会 圆满成功 谢谢大家,法律界 两岸同胞 法治 人士 法学 两岸 坚定不移 交流合作 司法 基础 两岸关系 祖国大陆 工作室 检察 中华 法治建设 发展 台独 本届 台胞 第七届 法学论坛 保障 法律服务 心灵 契合 九二共识 应有 深化 扩大开放
