title,date,content,X1,Unnamed: 0,segs,keywords
俞正声会见出席第九届海峡论坛两岸各界人士,2017,6月17日，中共中央政治局常委、全国政协主席俞正声在厦门会见出席第九届海峡论坛的部分两岸嘉宾和主办单位代表。这是俞正声与中国国民党主席洪秀柱握手。新华社记者 马占成 摄,47,47,月 17 日 中共中央政治局常委 全国政协主席 俞正声 在厦门 会见 出席 第九届 海峡论坛 的部分 两岸 嘉宾 主办单位 代表 这是 俞正声 中国国民党主席 洪秀柱 握手 新华社记者   马占成   摄 新华社 厦门 月 17 日电 记者 陈菲 刘欢 许雪 毅 中共中央政治局常委 全国政协主席 俞正声 17 日下午 在厦门 会见了 出席 第九届 海峡论坛 的部分 两岸 嘉宾 主办单位 代表 俞正声 说 海峡论坛 一路走来 两岸 基层 交流 的重要 平台 离不开 两岸同胞 关心 支持和 参与 在座的 许多朋友 旗帜鲜明地 九二共识 坚决反对 台独 为维护 两岸关系 和平发展 增进 两岸同胞 福祉 亲情 作出了 积极努力 俞正声 指出 两岸关系 和平发展 符合 两岸同胞 共同心愿 利益 是一条 正确道路 两岸关系 和平发展 正确方向 关键是 要坚持 九二共识 政治 基础 反对 台独 九二共识 的核心 一个中国原则 认同 大陆 台湾 同属 一个中国 清晰 界定 两岸关系 性质 明确了 两岸 国与国 的关系 这个问题 讲清楚 两岸 之间的 很多问题 可以通过 协商 找到 解决办法 民进党 当局 始终 不承认 九二共识 不认同 两岸 同属 一中 破坏了 两岸关系 和平发展 的政治 基础 两岸关系 性质 说清楚 以实际行动 接受 两岸同胞 检验 是一个 绕 不开 的问题 俞正声 今年是 两岸同胞 打破 隔绝 状态 30 年 两岸关系 和平发展 的大 背景下 两岸 形成了 民间 交流 格局 增进了 同胞 福祉 亲情 两岸关系 和平发展 冲击 更需要 两岸 民间 交流 两岸 基层 民众 青年一代 来往 多交流 增进了解 融洽 感情 拉近 心理距离 俞正声 两岸同胞 不可分割的 命运 共同体 深化 两岸 经济社会 融合 发展 就是要 促进两岸 命运 共同体 建设 大陆 有关部门 正 陆续 出台 一系列 便利 台湾同胞 在大陆 工作 生活的 政策措施 台胞 在大陆 工作 生活 享有 更多 便利 更好 条件 进一步 促进两岸 经济社会 融合 发展 中国国民党主席 洪秀柱 台湾 人士 在发言中 民进党 当局 毁坏 两岸关系 和平发展 基础 两岸关系 低迷 之际 举办 海峡论坛 意义重大 两岸 交流 九二共识 基础 之下 已获得 两岸 民心 高度认同 台湾 各界 民众 期盼 两岸一家亲 的理念 持续 推动 两岸 管道 民间 交流 深化 经济合作 参与 一带一路 促进两岸 经济社会 融合 发展 开启 两岸 灿烂 的未来 林文漪 顾秀莲 等与 台湾的 90 多名 各界 代表 参加会见 会见 前 俞正声 出席了 两岸 美丽 新人 集体婚礼 活动 充分肯定 两岸 婚姻家庭 增进 两岸同胞 亲情 促进两岸 交流 融合 推动两岸关系和平发展 发挥的 独特 作用 并为 100 位 喜结连理 两岸 新人 送上 祝福,俞正声 两岸 两岸关系 和平发展 海峡论坛 交流 新人 两岸同胞 的部分 17 基础 九二共识 融合 促进两岸 第九届 民间 经济社会 代表 中国国民党主席 亲情 主办单位 洪秀柱 在厦门 性质 中共中央政治局常委 基层 全国政协主席 嘉宾 命运 共同体
张志军会见中国国民党主席洪秀柱,2017,新华社南京６月１５日电　中共中央台办主任张志军１５日在南京会见来访的中国国民党主席洪秀柱。张志军表示，我们高度重视国共两党关系，愿在坚持“九二共识”、反对“台独”的共同政治基础上，继续保持沟通，加强交流对话，维护两岸关系和平发展与台海和平稳定。双方还就两岸关系等交换了看法。,467,467,新华社 南京 月 日电 中共中央台办 主任 张志军 日 在南京 会见 来访 中国国民党主席 洪秀柱 张志军 高度重视 国共两党 关系 愿 在坚持 九二共识 反对 台独 政治 基础上 保持沟通 交流 对话 维护 两岸关系 和平发展 台海 和平稳定 还就 两岸关系 交换了 看法 洪秀柱 此行 将赴 淮安 参访 赴 厦门 出席 第九届 海峡论坛,洪秀柱 张志军 还就 将赴 淮安 此行 在南京 保持沟通 交换了 第九届 中国国民党主席 南京 来访 看法 国共两党 参访 厦门 海峡论坛 在坚持 关系 高度重视 对话 两岸关系 基础上 会见 和平稳定 出席 台海 维护 政治
国台办：第九届海峡论坛准备就绪,2017,国务院台办发言人马晓光6月14日在例行新闻发布会上首先宣布，第九届海峡论坛将于6月17日至23日在福建举办，论坛大会将于6月18日在厦门举行。目前各项筹备工作已经就绪。中共中央政治局常委、全国政协主席俞正声将出席海峡论坛。中国国民党主席洪秀柱，亲民党、新党、无党团结联盟等政党代表和台湾有关县市代表、台湾主办单位代表，以及台湾各界人士等8000余人将应邀出席本届论坛。,420,420,国务院台办 发言人 马晓光 月 14 日在 例行 新闻发布会上 第九届 海峡论坛 将于 月 17 日至 23 日 在福建 举办 论坛 大会 将于 月 18 日 在厦门 各项 筹备工作 就绪 中共中央政治局常委 全国政协主席 俞正声 出席 海峡论坛 中国国民党主席 洪秀柱 亲民党 新党 无党团结联盟 政党 代表 台湾 县市 代表 台湾 主办单位 代表 台湾 各界人士 8000 余人 应邀出席 本届 论坛 马晓光 本届 论坛 民间性 草根 性 广泛性 定位 围绕 民间 交流 深化 融合 发展 主题 精心 筹划 和设计 30 多项 相关 活动 体现出 以下特点 一是 汇聚 两岸 民众 智慧 首次 设立 网络平台 台湾 民众 公开 征选 海峡论坛 活动 创意 方案 举办 海峡论坛 金点子 大赛 活动 征选 台湾 优秀 创意 纳入 活动安排 二是 交流 界别 领域 坚持以 民众 需求 导向 围绕 工 青 妇 三大 品牌 姓氏 宗亲 同乡 社团 民间信仰 大陆 配偶 四大 纽带 文化 教育 医疗 法律 工商 五大 领域 农 渔 水利 乡镇 村里 社区 协会 公益 慈善 六大 基层组织 设计 活动 继续扩大 交流 界别 领域 提供 两岸 交流合作 平台 三是 服务 青年 双创 举办 海峡 青年 论坛 新青年 新世代 第七期 领袖 特训营 两岸 人才交流 对接 等活动 邀请 台湾青年 参加 体验式 交流 面向 台湾青年 推出 就业 实习 岗位 创业 席位 服务 两岸 青年 台湾青年 大陆 就业创业 四是 回顾 两岸 交流 成果 展望 融合 发展 未来 今年是 两岸 打破 隔绝 状态 开启 民间 交流 30 周年 两岸 经济社会 融合 发展 已经成为 两岸 深化 交流合作 发展方向 论坛 把握 30 周年 融合 发展 两个 关键词 活动安排 中 亲历者 讲述 回顾历史 展望未来 马晓光 代表 论坛 组委会 记者朋友 赴 论坛 采访,论坛 海峡论坛 交流 活动安排 征选 代表 两岸 界别 活动 创意 融合 领域 30 举办 青年 台湾青年 将于 发展 民众 本届 围绕 周年 台湾 民间 基层组织 同乡 以下特点 和设计 席位 姓氏
国台办：台湾当局应该认清客观大势，做出明智抉择,2017,国务院台办发言人马晓光6月14日在例行新闻发布会上回答台湾记者普遍关注的有关中巴建交相关问题时表示，世界上只有一个中国，坚持一个中国原则是国际社会的普遍共识，中巴建交是人心所向，大势所趋。大家都记得，2008年到去年“5.20”之间，两岸双方在反对“台独”、坚持“九二共识”的共同政治基础上，开创了两岸关系和平发展的新局面，包括双方减少了在涉外领域的摩擦。去年，台湾政局发生重大变化后，我们多次明确表示，我们的对台大政方针不会改变，我们在反对“台独”、坚持“九二共识”政治基础上走两岸关系和平发展道路的立场和态度也不会改变。但是，从去年“5.20”以来，两岸关系和平发展的政治基础遭到了破坏，造成两岸关系和平发展以往的成果受到严重冲击。是谁在改变两岸关系的现状，是谁没有诚意走和平发展的道路，责任是非常清楚的。,260,260,国务院台办 发言人 马晓光 月 14 日在 例行 新闻发布会上 回答 台湾 记者 关注的 中巴 建交 相关问题 时 世界上 只有一个 中国 一个中国原则 国际社会 共识 中巴 建交 人心所向 大势所趋 大家都 记得 2008 年到 去年 5.20 之间 两岸 双方在 反对 台独 九二共识 政治 基础上 开创了 两岸关系 和平发展 新局面 包括 减少了 在涉外 领域 的摩擦 去年 台湾 政局 发生 重大变化 明确表示 我们的 对台 大政方针 不会改变 我们在 反对 台独 九二共识 政治 基础上 走 两岸关系 和平发展道路 的立场 态度 不会改变 从去年 5.20 两岸关系 和平发展 的政治 基础 遭到了 破坏 两岸关系 和平发展 以往 的成果 冲击 谁在改变 两岸关系 的现状 是谁 没有诚意 走 和平发展 的道路 责任 是非常 清楚的 马晓光 体现 一个中国原则 九二共识 两岸关系 和平发展 定海神针 承认 九二共识 认同 两岸 同属 一中 的核心 意涵 两岸关系 重回 和平发展 正确方向 台湾当局 认清 客观 大势 做出 明智 抉择,和平发展 中巴 两岸关系 不会改变 建交 九二共识 去年 基础上 是谁 的摩擦 减少了 记得 是非常 在涉外 谁在改变 20 明智 没有诚意 清楚的 大家都 从去年 客观 抉择 遭到了 关注的 明确表示 相关问题 开创了 的现状 政局
国台办：新一批便利台湾同胞的政策措施有望近期出台,2017,国务院台办发言人马晓光6月14日在例行新闻发布会上应询表示，一段时间以来，我们陆续公布了为台湾同胞在大陆学习、就业、创业、生活提供便利的政策措施，在5月10日国台办的新闻发布会上，我们已经做了相关介绍。据了解，有关部门仍在积极研究新的政策措施，部分措施有望近期出台。主要有：,351,351,国务院台办 发言人 马晓光 月 14 日在 例行 新闻发布会上 应询 一段时间以来 陆续 公布 了为 台湾同胞 在大陆 学习 就业 创业 生活 提供便利 政策措施 月 10 日 国台办 新闻发布会上 已经做了 相关 介绍 据了解 有关部门 仍在 研究 新的 政策措施 措施 有望 近期 出台 主要有 在大陆 就业 台湾 居民 享有 住房公积金 缴存 使用权利 住房 城乡 建设部 正 会同 有关部门 调研 将在 福建 上海 等地方 经验 做法 的基础上 近期 出台 全国范围 政策 在大陆 就业 台湾同胞 平等 享有 住房公积金 待遇 支持 缴存 住房公积金 提高 购房 和租房 能力 帮助他们 在大陆 安居 在大陆 居住 就业 就学的 台湾 居民 可在 大陆 参加 社会保险 进一步明确 和规范 台湾 居民 在大陆 参保 有关规定 保障 在大陆 居住 就业 就学的 台湾 居民 社会保险 权益 人力资源 社会保障部 研究制定 台湾 居民 在大陆 参加 社会保险 政策文件 在大陆 居住 但未 就学 未就业 台胞 参加 城镇居民基本医疗保险 有关政策 也将 一并 研究 据了解 相关 政策文件 征求 国务院有关部门 和地方的 意见 将在 进一步完善 适时 发布实施 财政部 教育部 将为 在大陆 高校 就读 台湾 学生 增设 具有较高 荣誉 性质的 奖学金 项目 在目前 设立 高校 台湾 学生 奖学金 基础上 财政部 正 会同 教育部 研究 在大陆 就读 台湾 学生 增设 具有较高 荣誉 性质 的奖项 拟 2017 年 秋季学期 正式 实施 国家旅游局 旅游 住宿 企业为 台湾同胞 提供 更加便利 旅游 住宿服务 近日 国家旅游局 下发文件 要求各地 旅游管理 部门 政策指导 旅游 住宿 企业 严格遵守 国家法律法规 和相关 政策规定 不得以 非正常 理由 台湾同胞 办理 入住 设置障碍 严格规范 服务标准 提高 服务意识 台湾同胞 提供 优质 便利的 住宿服务 银行业 将改进 台胞 小额 信用卡 服务 为解决 台胞 申办 信用卡 门槛 较高 中国银监会 指导下 部分银行 已调整 或拟 调整 台胞 申办 信用卡业务 政策 工商银行 总行 已下发 新版 个人客户 信用 授信 管理办法 申请办理 信用卡的 台胞 年龄 须在 25 周岁 65 周岁 之间 外 准入条件 大陆 公民 银行 可根据 内部 评级 模型 对客户 信用 评分 并根据 评分 给予 3000 元至 20000 元的 授信额度 部分银行 也已 下发通知 一线人员 进一步提升 涉台 金融业务 水平和 服务意识 据了解 为做好 在大陆 高校 就读 台湾 应届毕业生 就业服务 工作 教育部 研究 相关政策 有意愿 在大陆 就业 符合条件的 大陆 高校 应届毕业生 为他们 发放 就业协议书 签发 全国 普通高等学校 本专科 毕业生就业 报到证 全国 毕业 研究生 就业 报到证 进一步 在大陆 就读 台湾 学生毕业 就业 提供 政策 上的 便利,在大陆 就业 教育部 居民 就读 高校 研究 住房公积金 台湾 社会保险 服务意识 政策文件 评分 应届毕业生 就学的 住宿服务 部分银行 居住 旅游 信用卡 申办 周岁 具有较高 报到证 据了解 信用 国家旅游局 学生 财政部 台胞
国台办：坚持共同政治基础　推进国共两党关系,2017,有记者提问，吴敦义当选国民党主席后表示，坚决反对“台独”，主张“九二共识”、“一中各表”；“一中各表”的“九二共识”不会表成“两个中国”、“一中一台”，请问对此有何评论？国务院台办发言人马晓光6月14日在例行新闻发布会上应询表示，我们注意到了有关报道。“九二共识”的核心意涵是认同两岸同属一中，它明确界定了两岸关系的性质，表明两岸不是国与国关系。多年来，国共两党在坚持“九二共识”、反对“台独”的共同政治基础上，推进两党关系和两岸关系和平发展，取得丰硕成果。我们愿与国民党在此共同政治基础上，继续保持沟通，加强交流对话，共同致力于增进两岸民众福祉，维护和推动两岸关系和平发展与台海和平稳定。,306,306,记者 提问 吴敦义 当选 国民党主席 坚决反对 台独 九二共识 一中各表 一中各表 九二共识 表成 两个中国 一中一台 请问 对此 有何 评论 国务院台办 发言人 马晓光 月 14 日在 例行 新闻发布会上 应询 注意到了 报道 九二共识 的核心 意涵 是认同 两岸 同属 一中 明确界定 两岸关系 的性质 两岸 国与国 关系 国共两党 在坚持 九二共识 反对 台独 政治 基础上 推进 两党关系 两岸关系 和平发展 丰硕成果 愿与 国民党 在此 政治 基础上 保持沟通 交流 对话 致力于 增进 两岸 民众 福祉 维护 推动两岸关系和平发展 台海 和平稳定,一中各表 九二共识 基础上 表成 是认同 国民党主席 两党关系 保持沟通 两个中国 政治 一中一台 国与国 注意到了 当选 吴敦义 的性质 愿与 意涵 国民党 两岸 的核心 丰硕成果 报道 国共两党 明确界定 在此 一中 致力于 在坚持 14
国台办：民进党只有改变“台独”立场才有可能与大陆改善关系,2017,有记者提问，民进党团总召柯建铭表示，“台独”党纲已经成为两岸交流的最大障碍，修改党纲是务实可行的做法，请问对此有何评论？国务院台办发言人马晓光6月14日在例行新闻发布会上应询表示，我们注意到了有关报道。民进党抱持“台独”党纲，坚持“一边一国”的“台独”分裂立场，是这个党与我们交往的根本障碍。只有放弃“台独”党纲，改变“台独”立场，民进党才有可能与大陆改善关系。,367,367,记者 提问 民进党 团总 召 柯建铭 台独 党纲 已经成为 两岸 交流的 障碍 修改 党纲 务实 可行的 做法 请问 对此 有何 评论 国务院台办 发言人 马晓光 月 14 日在 例行 新闻发布会上 应询 注意到了 报道 民进党 抱持 台独 党纲 一国 台独 分裂 立场 是这个 党 与我们 交往 的根本 障碍 放弃 台独 党纲 改变 台独 立场 民进党 有可能 大陆 改善 关系 民进党 籍 县市长 日前 提出 亲 中爱 台   和中   友中 说法 马晓光 应询 的说法 都应该 讲清楚 两岸关系 性质 根本问题 台独 立场 大讲 亲和 友善 这是 自相矛盾的 民进党 人士 如果真 改善和 发展两岸关系 诚意 就应该 言论 而且从 行动上 改弦更张 放弃 台独 立场,党纲 台独 立场 民进党 放弃 障碍 亲和 如果真 和中 团总 自相矛盾的 可行的 中爱 大讲 柯建铭 抱持 友中 是这个 就应该 而且从 都应该 根本问题 一国 有可能 改弦更张 友善 讲清楚 改善和 行动上 说法
国台办：民进党当局干扰阻挠两岸交流合作的做法有目共睹,2017,有记者提问，近期有大陆人员赴台交流行程遭到台湾当局的严格管控，台陆委会发言人称，会对大陆人员赴台交流的四类情形加以关注，而大陆拒绝台官员等人员赴陆才是阻碍两岸交流，请问对此有何评论？国务院台办发言人马晓光6月14日在例行新闻发布会上应询表示，我们一贯积极鼓励和支持两岸民间各领域的交流合作，这是众所周知的，也是有目共睹的。民进党当局上台以后，在干扰和阻挠两岸交流合作方面的做法不断升级，这也是有目共睹的。他们反过来倒打一耙，不过是心虚的表现。,380,380,记者 提问 近期 大陆 人员 赴台 交流 行程 台湾当局 管控 台 陆委会 发言人 称 会对 大陆 人员 赴台 交流的 四类 情形 关注 大陆 拒绝 台 官员 人员 赴 陆才 阻碍 两岸 交流 请问 对此 有何 评论 国务院台办 发言人 马晓光 月 14 日在 例行 新闻发布会上 应询 一贯 鼓励和支持 两岸 民间 各领域 交流合作 这是 众所周知 也是有目共睹 民进党 当局 上台 干扰 阻挠 两岸 交流合作 的做法 升级 也是有目共睹 倒打一耙 不过是 心虚 的表现,也是有目共睹 人员 赴台 四类 心虚 陆才 情形 倒打一耙 管控 的表现 会对 不过是 拒绝 升级 行程 官员 鼓励和支持 的做法 众所周知 阻碍 关注 上台 一贯 两岸 大陆 交流 交流合作 交流的 14 陆委会
国台办：两岸青年就业创业研讨会将在广东举办,2017,国务院台办发言人马晓光6月14日在例行新闻发布会上应询表示，为支持台湾青年来大陆实习、就业、创业，经过双方峰会商定，两岸企业家峰会将于7月7日至8日在广东省东莞市举办2017两岸青年就业创业研讨会。这次研讨会以“追逐梦想、开创未来”为主题，设置了就业创业政策介绍、经验分享、就业岗位推介、两岸青年互动等环节，旨在帮助台湾青年与大陆企业对接、寻找在大陆发展的机会。两岸企业家峰会曾培炎理事长、萧万长理事长，部分海峡两岸青年就业创业基地和示范点的负责人，两岸青年企业家和台湾青年学生代表将出席本次研讨会。,211,211,国务院台办 发言人 马晓光 月 14 日在 例行 新闻发布会上 应询 支持 台湾青年 大陆 实习 就业 创业 峰会 商定 两岸 企业家 峰会 将于 月 日至 日在 广东省东莞市 举办 2017 两岸 青年 就业创业 研讨会 研讨会 追逐梦想 开创 未来 为主题 设置了 就业创业 政策 介绍 经验 分享 就业 岗位 推介 两岸 青年 互动 等环节 旨在 台湾青年 大陆 企业 对接 寻找 在大陆 发展 的机会 两岸 企业家 峰会 曾培炎 理事长 萧万长 理事长 海峡两岸 青年就业 创业基地 示范点 的负责人 两岸 青年企业家 台湾青年 学生代表 出席 本次 研讨会,研讨会 峰会 台湾青年 理事长 企业家 两岸 就业创业 等环节 日在 追逐梦想 设置了 青年企业家 商定 广东省东莞市 青年 学生代表 的负责人 曾培炎 经验 推介 寻找 就业 的机会 旨在 开创 本次 创业基地 青年就业 示范点 萧万长
国台办：坚决反对“台独”和“港独”势力相勾结,2017,有记者提问，由黄国昌等多名台立法机构民意代表组成的所谓“关注香港民主连线”日前成立，还有几名香港议员赴台出席相关活动，引发争议，请问对此有何评论？国务院台办发言人马晓光6月14日在例行新闻发布会上应询表示，我们坚决反对“台独”和“港独”势力相勾结，干扰香港实施“一国两制”、插手香港内部事务、破坏香港繁荣稳定。这种图谋和行径不得人心，也不会得逞。,284,284,记者 提问 黄国昌 多名 台 立法机构 民意代表 组成的 关注 香港 民主 连线 日前 成立 几名 香港 议员 赴台 出席 相关 活动 引发争议 请问 对此 有何 评论 国务院台办 发言人 马晓光 月 14 日在 例行 新闻发布会上 应询 坚决反对 台独 港独 势力 相勾结 干扰 香港 实施 一国两制 插手 香港 内部事务 破坏 香港 繁荣 稳定 图谋 行径 不得人心 也不会 得逞,香港 连线 引发争议 议员 几名 黄国昌 内部事务 相勾结 港独 立法机构 插手 组成的 民主 也不会 关注 民意代表 繁荣 不得人心 稳定 多名 赴台 成立 得逞 14 相关 干扰 一国两制 实施 图谋 日在
国台办：中巴建交是人心所向，大势所趋,2017,新华社北京６月１３日电（记者齐湘辉）国台办发言人马晓光１３日应询表示，外交部已就中巴建交发表谈话。世界上只有一个中国。坚持一个中国原则是国际社会普遍共识，中巴建交是人心所向，大势所趋。,215,215,新华社 北京 月 日电 记者 湘辉 国台办 发言人 马晓光 日应 询 外交部 已就 中巴 建交 发表谈话 世界上 只有一个 中国 一个中国原则 国际社会 共识 中巴 建交 人心所向 大势所趋 马晓光 指出 体现 一个中国原则 九二共识 两岸关系 和平发展 定海神针 承认 九二共识 认同 两岸 同属 一中 的核心 意涵 两岸关系 重回 和平发展 正确方向 台湾当局 应 认清 客观 大势 做出 明智 抉择,中巴 建交 湘辉 发表谈话 明智 抉择 已就 客观 重回 认清 定海神针 意涵 一个中国原则 和平发展 的核心 做出 只有一个 一中 世界上 九二共识 马晓光 外交部 人心所向 承认 正确方向 大势所趋 国际社会 共识 日应 大势
