"","date_2018","Page.Name","Page.Category","Page.Admin.Top.Country","Post.Created","Total.Interactions","Message","Link"
"166","2018-09-10","性別平等教育大平台","EDUCATION_COMPANY","TW","2018-09-10 14:45:00 CST","113","【別讓學術研究成為反同工具 請正確認識性平教育】 　 在那自稱「愛家」的口號下，這些反同人士沒有說出口的暗語是：同志不配享有婚姻，因為你們不自然、同志就是污染源，只要提到你們就會造成小孩「錯誤混淆」，「把小孩都變成不好的同志」，所以國中小都不該被提到... 　 而為了將同志「恢復正常」，這些反同人士不斷提倡「無效且造成身心創傷」的「矯正治療」，並要求老師不得提到「同志也是人，並沒有不正常」；而為了將同志「重新趕回黑暗」中，他們持續散佈不實謠言與錯誤資訊，惡意中傷願意實施性平教育的老師，甚至連學術研究都成為他們曲解的工具，就像這篇文章所提到的那篇「台南大違反學術倫理、充滿宗教色彩的反性平教育論文」... 　 ❤️ 守護學術倫理，支持性別平等教育 ❌ 拒絕抹黑與不實研究，別讓學術研究成為反同工具 　 引文： 　 連最應該追求真理與事實的學術研究，也變成反同婚的工具。在一篇調查家長對於中學實施同志教育態度的碩士論文中，學者A明明是撰文批評要滿20-25歲才能算是同性戀的看法，該碩論作者卻移花接木，把A批評的論點說成是A的主張。學者B從公共衛生角度描述台灣愛滋病的流行現況與防治政策，通篇論文從未出現同志教育這4個字。該碩論卻說學者B指出台灣實施同志教育後，愛滋病不降反升。這已經不是理解能力有問題，而是有意栽贓了。 再者，刻意混淆教科書與教師之資源手冊，讓家長誤以為教師自修的內容會直接出現在中學的課堂。而同志婚姻在於打破一男一女的性別限制，作者又將之誤導成同志教育鼓吹多男多女的婚姻。最後，再以超過4成是基督徒與天主教徒的偏誤樣本，來代表一般的家長（台灣人口約有6%的基督徒╱天主教徒）。結果，一篇充滿誤讀理論文獻、偏差樣本、使用錯誤統計方法的學位論文，淪為宗教團體的傳聲筒。","https://tw.appledaily.com/headline/daily/20180910/38121635/"
"167","2018-09-13","台北真理堂","CHURCH_OF_CHRIST","TW","2018-09-13 20:30:00 CST","69","📢金蘋果獎宣傳片來囉!!!📢 #金蘋果獎 🍎 #愛家公投微廣告 🎬 🎈活動主旨🎈 鼓勵弟兄姊妹運用新媒體，倡議｢一夫一妻、一男一女、一生一世｣的自然婚姻家庭，並參與公共事務。 🎈活動規則🎈 🔎參賽對象 | 全國教會弟兄姊妹 💪團隊資格 | 3名成員為1組(不限年齡、職業、性別，不可跨組報名) 🎞影片提供 | 拍攝30~120秒的影片，上傳至youtube， 設定為不公開並將網址連結私訊金蘋果粉絲專頁 📆截止日期 | 即日起至10/14(日)中午12：00，截止收件 💰報名費用：每組300元 🎈獎項內容🎈 🥇第一名 | 獎金新台幣六萬元整 🥈第二名 | Apple iPad 9.7吋 32G 金 WiFi版 🥉第三名 | Airpods蘋果原廠藍芽無線耳機 (還有其它獎項喔) 🎈#報名連結 與 #詳細內容與獎項🎈 👉https://goo.gl/avsGSe:=:http://www.tlc.org.tw/portal_b1_page.php?owner_num=b1_440038&button_num=b1&folder_id&cnt_id=58519&order_field&order_type&search_field&search_word&search_field2&search_word2&search_field3&search_word3&bool1&bool2&search_type=1&up_page=1 　 ✨一起用媒體來傳達🎥 💖家是無條件愛你的地方💖 #如此豐盛的獎品 #還沒報名嗎 #趕快組隊報名吧 #小編已經準備組隊了","https://www.facebook.com/taipeitlc/videos/539138343212229/"
"168","2018-09-13","性別平等教育大平台","EDUCATION_COMPANY","TW","2018-09-13 12:00:01 CST","109","【 家庭教育法施行細則修正草案 北區公聽會 】 ——「愛家」人士荒謬實錄 2 　 親密之旅課程的進階種子講師 劉ＯＯ 　 「我自己也是家長、還有參加家長會，那我自己另外有二十多年的經驗在做青少年的輔導，我常常都在陪伴很多的家庭的問題，那我提供一點我自己的、我有仔細看這個施行細則的修正條文，我想一個家庭幾個主要的成員就是父母、子女、夫妻，在家庭裡面這是很重要的，那當然如果孩子、子女之間手足的關係也是一個，但是我覺得最基本的這幾個成員，所以我看了這個、我覺得整個計畫修正的是很用心，希望把一些施行的細節、辦法，把他訂得更準確。可是，我覺得在一些名詞上，本來我們已經用的很習慣的，可能反而改了以後覺得比較『模糊化』。所以我覺得，因為『我們一般講到家庭一定會說父母、子女』，所以我其實不太贊成說把父母直接修正成家長齁，尤其民法裡面也是這樣寫，所以我們通常在做那個家庭的輔導的時候，如果他不是父母，我們就講他可能是孩子的監護人或等等也許延伸的，可是，我覺得如果在家庭教育法裡面，把父母這個角色，因為有子女嘛，父母這個其實還是要保留，這樣才會比較清楚。 另外就是談到婚姻這個部分，也許在婚前不是確定，可是我覺得談到婚姻關係的時候，應該要把夫妻這個名詞寫上來，他其實原本沒有修改的時候就是清楚的，所以我的建議就是說，修改的時候不要把原本清楚的東西把它改成不清楚，我們的目的其實是要讓整個國家社會的家庭的整個各方面都能夠建造的更好。 另外呢，剛剛聽主持人所解釋那個第七條多元文化是因為，原來在母法有考慮到有許多跨國的婚姻的這樣的結合問題，那我在想修正的時候為什麼不把他寫清楚一點，是增進，因為的確我在帶的輔導家庭裡蠻多的那個外配啊，還有我其實幫助他們很多就是這種多元文化，我覺得這個要很明確寫說增進對不同國籍的家庭文化，因為這個才是很明確的我們國家現在面對的，常常我們在一個班上，我在學校當那個家長委員，其實不同國籍這個反而是我們很陌生的，而且包括那個當事人（外配）的媽媽，比較多是媽媽，他們自己的這個部分，我們應該要去幫助這樣的一個媽媽的角色，或是怎麼樣去教育他，建立他的自信心，不然他怎麼去帶孩子」 　 👉 因為主辦單位並未提到這位「愛家」人士的單位，所以我們只好用他自己說的「親密之旅課程的進階種子講師」來代表，親密之旅課程是由主打「堅守婚姻」的「愛家文化事業基金會」所舉辦，其背後帶有非常強烈的基督教色彩，有興趣的朋友歡迎Google ”親密之旅” “基督教” ，就可以看到相當多的資料摟～ 　 👉 雖然這段發言不斷試圖「包裝」，但其對於「非一男一女」婚姻、「非一夫一妻」家庭的排除及貶意仍是相當明顯，對於外籍配偶的看法也相當不平等，其問題包含： 　 1️⃣ ️這位「愛家」人士的說法其實自相矛盾，他自己說在做家庭輔導時，也有不是「父母」的其他照護者及監護人，但他又堅持不能用「家長或監護人」，這衝突點不僅是邏輯問題，更帶出他對於非「一夫一妻」家庭的排除和貶意 　 2️⃣ ️就如主席一開始所解釋的，本次施行細則之所以會把「父母」修正為「家長或監護人」，正是為因為考量到家庭包含雙親、單親、繼親、隔代教養等各種家庭，並符應母法《家庭教育法》現行第15條已使用「家長或監護人」之陳述、以及因應釋字748大法官解釋，才做出此修正以『符合實際』情況。所以，這段發言完全在顛倒是非，將「父母」修正為「家長或監護人」不僅讓所指範圍更加明確、也才能符合台灣的真實情況歐！大家真的要好好聽主席的說明呀，不要亂曲解💢 　 3️⃣ ️這位「愛家」人士所提到「多元文化應該就只寫跨國婚姻」，所針對的是施行細則第二條第七項的修正：「七、多元文化教育：指增進對不同族群家庭文化理解及尊重之教育活動。」其實，這項主席一開始就以解釋，除了跨國婚姻外，又「多元文化教育包羅萬象，包含不同國家、地區、種族/族裔/族群等範圍」，所以後來才將其修正為「不同族群家庭文化」，但很明顯，這位「愛家」人士完全沒在聽... 4️⃣️ (truncated)","https://www.facebook.com/twgeec/photos/a.1980959928886680/2085672221748783/?type=3"
"169","2018-09-13","性別平等教育大平台","EDUCATION_COMPANY","TW","2018-09-13 22:00:01 CST","96","【 #三個不同意讓幸福OK 廣播後續延伸閱讀～】 　 真的很感謝林邦文老師邀請我們上 公民總主筆 節目（昨天直播：http://bit.ly/2CCOfvm:=:https://www.facebook.com/login/?next=https%3A%2F%2Fwww.facebook.com%2Ftwgeec%2Fposts%2F2085419971774008%3F__xts__%255B0%255D%3D68.ARDMX5hKA_JvT6hlhmmoH3N08LLo25OeMVHoOM7zg2BtFUNfovd6LGgqTyRsDTXdrK2dVOoesGqALNRCCn0Mjdrop6M0yZlVhv5KUy2YbhdLnUJZNtCosoUIwrsajXZw0ow0v_RYoJrisNM_3knuX7_x7ZXTAylH-GmC0T1m76BfPKBLFzZ7Fg%26__tn__%3D-R），讓更多朋友瞭解性別平等教育，以及知道反同三公投所帶來的傷害！ 而雖然性別平等教育近來受到很多打壓，但就像這張照片一樣，希望大家跟我們一起打氣，一起努力消除不實謠言，並用 #三個不同意讓幸福OK ❤️🧡💛💚💙💜 　　 而因為昨天的反應很熱烈，我們也製作了相關的延伸閱讀，希望能讓更多人了解性平教育的相關內涵與現況～ 　 　 【一】最近有一群自稱「愛家」的團體到處積極宣傳反對同志公投的提案，這三個公投提案內容是什麼？又會對台灣帶來什麼影響呢？ 　 這些「假愛家」團體的真面目其實就是「真反同」、「真歧視」，而他們推出的三個提案是： 1. 婚姻是一男一女的專利，同性伴侶閃邊去 2. 同性伴侶在一起是可以啦，但你們不配享有婚姻，請用另外的專法區隔他們 3. 老師跟小孩說什麼是同志，小孩就會被誤導污染，所以國中小不能教和提到同志 　 而一旦這三個提案通過，將造成台灣社會更加撕裂與對立，尤其是最後教育相關這案，一但通過，將使得性別平等教育殘缺不全，學生無法透過正確的認識進而學會尊重，友善校園難以推行，嘲笑、欺負、霸凌再度增加...😥😭🤕 　 想知道更多資訊，請看這：https://ppt.cc/f9XARx:=:https://www.facebook.com/login/?next=https%3A%2F%2Fwww.facebook.com%2Ftwgeec%2Fposts%2F2066966743619331 　 　 【二】聽說，之前這些反同團體在拉公投第二階段連署時，甚至連不應出現宗教／政治團體宣傳活動的校園內，也驚見「把連署書貼在聯絡簿請孩子帶回去給家長簽名」、「在辦公室要求其他老師一同連署」等行為？ 　 是的，這群反同人士用各種惡質手段蒐集連署，從「校園中不對等權力關係」(https://ppt.cc/fzrqpx:=:https://www.facebook.com/twgeec/photos/a.1980959928886680/2039028159746523/?type=3&theater)、「說謊騙人說是支持同志」(https://ppt.cc/fpRuHx:=:https://www.facebook.com/login/?next=https%3A%2F%2Fwww.facebook.com%2Ftapcpr%2Fposts%2F10155538859085965)、「濫用公家資源誤導民眾」(https://ppt.cc/fVMjxx:=:https://www.facebook.com/login/?next=https%3A%2F%2Fwww.facebook.com%2Fphoto.php%3Ffbid%3D10157968542366164%26set%3Da.10150413682291164%26type%3D3%26theater) 、趁街賣者身體不便就「冒名代簽」(https://ppt.cc/f5sfcx:=:https://www.facebook.com/login/?next=https%3A%2F%2Fwww.facebook.com%2F31611GT%2Fvideos%2F497883687303703%2F) 等等... 　 光是5~6月，我們就收到10起以上的案件，為了阻擋這種惡質事件傷害校園中的學生，教育部也在7月13日發函「禁止校園內硬拉反同公投連署之行徑」（https://ppt.cc/fzrqpx, https://ppt.cc/f9eTkx:=:https://www.facebook.com/login/?next=https%3A%2F%2Fwww.facebook.com%2Ftwgeec%2Fposts%2F2071779756471363 ） 　 　 【三】隨著反同公投的宣傳，許多Line群上都有人轉傳說性平教育會傷害學生、都在教學生六歲肛交、九歲口交，這是真的嗎？如果是假的，性別平等教育到底在談些什麼？而為什麼台灣會需要性平教育呢？ 　 這些當然都是假的摟！ 性別平等教育的施教重點一直都在，讓學生 1. 認識自我，好好對待自己、愛自己 2. 平等且同理地對待他人，瞭解他人的處境與想法，不要去傷害他人 3. 去除刻板印象與不平等壓迫，減少各種性別上的歧視與傷害 　 性平教育的目的是從「學生」出發，希望能讓學生不要再活在「無知」、「錯誤資訊」、「恐懼」、「霸凌」之中，並且讓每一個孩子都能平安自在地長大，好好的愛自己，尊重彼此 　 而教育部也有推出懶人包與說明，歡迎大家多多參考（https://ppt.cc/fQTj4x, https://ppt.cc/fjbZ5x:=:https://www.facebook.com/twgeec/photos/a.1980959928886680/1992570694392270/?type=3&theater），除了懶人包外還想了解更多資訊的朋友，也可以上「教育部性別平等全球資訊網」查詢（https://ppt.cc/fwPHbx:=:https://www.gender.edu.tw/web/index.php/home/index）歐 　 　 【四】在我們前面提到三個反同提案中，其中「國中小禁止實施同志教育」的提案明顯就是針對性別平等教育中的同志教育而來，而「同志教育」真的像有些傳言說的是「同志養成教育」嗎？如果不是，那內容到底在教什麼呢？ 　 當然不是摟～ 「同志教育」不是魔法，無法把不是同志的人變為同志，大家真的不要擔心這件事！相關完整說明，請看這：https://ppt.cc/f5gO9x:=:https://www.facebook.com/login/?next=https%3A%2F%2Fwww.facebook.com%2Ftwgeec%2Fposts%2F2082684625380876 　 而同志教育到底在教什麼呢？ 同志教育是希望讓學生認識各種性傾向、性別認同與性別特質，從接納自我出發，了解同志的社會處境，進而尊重同志，並建立性別友善的社會環境 　 更簡化來說，就是「認識同志及各種性別特質，學習尊重友善」的教育 而教育部在今年5月17日 國際反恐同日也有相關說明，歡迎參考：https://ppt.cc/frtgQx 　 ＊額外補充：楊佳羚老師的「同志教育怎麼教？」 https://youtu.be/mp2CCtEPAPA:=:https://www.youtube.com/watch?v=mp2CCtEPAPA&feature=youtu.be 　 　 【五】 最近好像有不少針對「不當性平教材」的傳言，請問這些是真的嗎？那我們面對這類謠言時該如何處理呢？ 　 (truncated)","https://www.facebook.com/twgeec/photos/a.1980959928886680/2086132595036079/?type=3"
"170","2018-09-14","台灣同志家庭權益促進會","NON_PROFIT","TW","2018-09-14 13:19:08 CST","49","🤔如果礙家公投通過的話．．． 　　 #立專法成為執政黨的唯一選項 #行政院三個月內要提出草案 #立法院需在2019年審議完成 #公投結果兩年內都不能變動 　　 【 重點整理 】 　　 0:23 公投是什麼？ 0:50 警世小案例：英國脫歐公投 🇬🇧 2:57 為什麼台灣過去的公投全數失敗？🏳️ 3:46 所以今年底揪竟要投什麼ㄋ？🇹🇼 4:16 公投通過會怎樣？來假想愛家公投吧！👨‍👩‍👧‍👦 5:23 🏳️‍🌈同志族群的想法是⋯⋯🏳️‍🌈 6:18 ⭐️⭐️⭐️ 年滿 18 歲就可以去公投啦～🗳 　　 註１：3:22 人數以 2016 總統大選投票人數計算 修法後公投門檻： ✍🏻提案：上次總統副總統選舉人總數 1/10000 ✍🏻連署：上次總統副總統選舉人總數 1.5％ ✍🏻通過：同意＞不同意，且同意票超過選舉人總數 1/4 　　 註２：愛家公投原文 4:29 你是否同意民法婚姻規定應限定在一男一女的結合？ 4:35 你是否同意以民法婚姻規定以外之其他形式來保障同性別二人經營永久共同生活的權益？ 4:40 你是否同意在國民教育階段內（國中及國小），教育部及各級學校不應對學生實施性別平等教育法施行細則所定之同志教育？ 　　 #11月24日投下三個不同意票 #三個不同意 #幸福OK #同家會年度志工招募中🔜http://bit.ly/2MmZsR5:=:https://docs.google.com/forms/d/e/1FAIpQLSe0L0HdLE-vsp5EfsybVLhxBOuctFBUBmDCRkug0gu7eB5crg/viewform?usp=send_form ---- 🎨擇愛成家，異同捐款支持同家會：http://www.lgbtfamily.org.tw/contactus_03.php:=:https://www.lgbtfamily.org.tw/contactus_03.php 💕電子發票捐贈愛心碼：６８７８ 🌈同家會官網：http://www.lgbtfamily.org.tw:=:https://www.lgbtfamily.org.tw/","https://www.youtube.com/watch?v=-d7spLkS5RE&utm_source=Facebook_PicSee"
"171","2018-09-16","黃捷 高雄市議員","POLITICIAN","TW","2018-09-16 12:00:01 CST","134","【11月24日，為平權返鄉投票】 我們一起返鄉投票，對「歧視公投」投下三個不同意，只要你年滿18歲，就能夠參與公投，用公投票的力量，決定我們要的平等價值！ / 什麼是歧視公投？ 1、將同志結婚的權利排除在民法保障之外，公投主文包括 →你是否同意民法婚姻規定限制在一男一女？ →你是否同意以民法婚姻規定以外之其他形式來保障同性別二人永久共同生活的權益？ 2、反對認識同志教育，公投主文為 →你是否同意在國民教育階段內（國中及國小）教育部及各級學校不應對學生實施性別平等教育法施行細則所定之同志教育？ / 對上面三個公投，投下不同意票！ 台灣不必也不應該另立一部「同志專法」同性結婚的權利。同志所需要的法律上保障和異性戀並沒有不同，以性傾向作為區別來適用不同部法律，是一種歧視！ 另外，性教育、同志教育是教導孩子認識自我和尊重別人非常重要的一個過程，認識自己，也認識和自己不同的人。不再讓孩子的「特別」成為孩子一輩子的傷痛。 / 滿18歲的你，就可以投下公投票！ 今年11月24日，除了九和一選舉，也是公投的日子。如果你滿18歲了，請和我們一起捍衛性別平權，針對三個歧視公投投下三個不同意！ / 政治就是我們的生活方式，是落實理念的通道 我是黃捷，我代表時代力量參選高雄市鳳山區市議員，我要把性別平權送進高雄市議會。這塊土地上的每個人，都值得享有台灣民主自由平等的價值，每個人，都有相愛的權利，更值得和所愛的人在所愛的故土上好好生活。 相關網站 婚姻平權大平台 https://www.facebook.com/equallovetw/ 平權前夕．彩虹起義 https://www.facebook.com/Vote4LGBT/","https://www.facebook.com/FongshanHuangjie/photos/a.2062441127416960/2110807635913642/?type=3"
"172","2018-09-17","國度復興合一禱告聯盟（原《國度復興報》）","TOPIC_PUBLISHER","TW","2018-09-17 10:00:01 CST","47","#世界瞭望 #歐洲 羅馬尼亞將公投 明訂一夫一妻婚姻定義 　羅馬尼亞將在10月公投決定是否修憲，將家庭定義為一男一女的結合並禁止同性婚姻。 　羅馬尼亞參議院11日以107票對13票、7票棄權，通過為修憲鋪路的法律。按羅馬尼亞目前法律，婚姻為「配偶」間的結合。眾議院去年5月也以232票支持、22票反對、13票棄權，通過修憲法案...https://goo.gl/k3A1MR:=:https://krtnews.tw/index.php 【享】閱讀：http://krtnews.tw/:=:https://krtnews.tw/ 【想】奉獻：http://krtnews.tw/dedication-support.html:=:https://krtnews.tw/index.php","https://goo.gl/k3A1MR"
"173","2018-09-17","吳威志的法政世界","TUTORING","TW","2018-09-17 13:25:46 CST","44","【無法解決民主爭端的假公投】 2018年9月15日中華日報〈 府城廣角鏡 〉 吳威志（國立雲林科技大學科技法律研究所教授/前行政院公民投票審議委員會委員） 　 中選會受理第二階段公投連署書，目前估算有國民黨、以核養綠、幸福盟、東奧正名與婚姻平權等十個公投案。中選會後續還要查核，但近日卻對外表示來不及就都不綁大選；言下之意，公投似將變成一場全民皆輸的遊戲。 　 我國近十年僅有六項公投成案，但去年民進黨主導《公民投票法》修法放寬標準後，除刪除公投審議委員會、下修公投年齡到十八歲外，各項門檻也大幅降低，提案約為兩千人、連署約為二十八萬人而已，造成目前提案量大增，衍生公投許多亂象。 　 事實上，公投綁大選必須投入約二十萬名選監人力，總經費至少四十億元，甚至開票恐到凌晨十二點過後；且依《公民投票法》第二十九條規定，通過只要有效同意票數多於不同意票，且有效同意票達投票權人總額四分之一以上者，約四百七十萬票即可。 　 以此次提案受人矚目的，愛家公投與婚姻平權兩派人馬對決而言，幸福盟推出三項愛家公投為：一男一女婚姻、不適齡教材禁入國中小學、同性關係另立專法；各案連署書分別高達一百九十八萬餘份。相對地，同性婚姻平權推動二公投，都與愛家公投議題背道而馳。不過，可笑的是，這五項公投都達第二階段連署門檻，預測將來全民投票五案也都可能全過，屆時，勢必造成政府決策的矛盾與爭議。 　 其次，又以民間發起的「以核養綠」公投案為例，發生連署書補件遭到拒絕，發起人絕食抗議；引起前總統馬英九、前行政院長張善政前往關注，並痛斥中選會是第二個促轉會，質疑中選會敷衍。若所指中選會以意識形態、雙重標準行政屬實，將對我國民主法治傷害極大。 　 再以國民黨推動反核食、反空汙、反深澳電廠三項公投案為例，均已完成第二階段公投連署各約四十九萬份。中選會卻表示，發現連署大量抄寫、連署資訊不正確等狀況。但中選會究竟是否針對目前收到的十項公投連署書都一視同仁對待令人存疑！ 　 依據《公民投票法》第十三條規定，進入第二階段係由中選會審查連署人數，若不足或經刪除未簽名或蓋章致人數不足，依法應通知補提；合於規定者，函請戶政機關查對連署人名冊，如有「連署人不合資格」、「書寫錯誤或不明」、「未經提案人簽名或蓋章」、「連署有偽造情事」應予刪除。 　 顯然，中選會對連署程序依法僅在查核人數計算及未簽名或蓋章者而已；至於真偽認定原則並未包含其中。而法定查對與刪除職權亦在「戶政機關」，一方面避免公開連署遭到有心人士亂簽或設陷，所以查有不對則以「刪除」處置；一方面也為避免中選會涉入政爭有失公正，仍以中立角色允許通知補提。縱使非親簽或連署有偽造情事，基於「公開、自由、任意」連署原則，依法僅是「刪除」而已。 　 確實，中選會可能有苦難言，若十個以上公投案結合大選，將會產生無法預測的亂象。不過，這亂源本是來自立法院民進黨團去年極為幼稚的修法。以目前中選會受理公投案來看，存在偏激的民粹議題，甚至涉及「國家認同」的議題，眼看公投也無法解決。如再結合大選，恐將激化選舉對立，反而要付出極高的社會成本。 　 推動公投案確屬不易，程序處處刁難、卡關並壓縮提案及連署時間。如果，最後各案即使通過，也無法解決憲政危機與社會紛爭，那麼，這場政治遊戲，豈不是自欺欺人、玩弄民主而已！ 【無法解決民主爭端的假公投】 2018年9月15日中華日報〈 府城廣角鏡 〉 吳威志（國立雲林科技大學科技法律研究所教授/前行政院公民投票審議委員會委員） http://www.cdns.com.tw/mobile/news.php?n_id=3&nc_id=252707:=:https://www.cdns.com.tw:443/mobile/news.php?n_id=3&nc_id=252707","https://www.facebook.com/1548557112099759/photos/a.1565094997112637/2179562428999221/?type=3"
"174","2018-09-17","禾馬文化　愛小說","TOPIC_PUBLISHER","TW","2018-09-17 17:35:41 CST","18","宸心和可樂的彩色泡泡夢　２０１８０９１７ 　 輕井澤拍到的溪邊鳥屋。 一夫一妻VS.一夫多妻.....指的是鳥吧?應該是鳥吧? 是說一夫多妻也可入住，是皇帝領著後宮寵妃出遊嗎?屋子不會太小嗎?......XDDDDD #輕井澤 #皇上吉祥","https://www.facebook.com/marchxin/photos/a.1493966534160436/2184745281749221/?type=3"
"175","2018-09-18","Blued","APP","CN","2018-09-18 18:29:30 CST","11","【古巴領導人贊成同性婚姻合法化】 古巴領導人米格爾·迪亞斯-卡內爾昨天在電視臺的訪談節目中說，他贊成「在沒有限制的前提下」承認人與人之間的婚姻關係，因為這樣做「有助於消除社會中任何形式的歧視」。 古巴全國人大已經批准了新的憲法草案，其中第68條將婚姻定義為「兩人之間自願的結合」，不再限定「一男一女」。 草案有望在明年的公投中被通過。 藍小編先祝福古巴在婚姻平權上，獲得嶄新的一步。","https://www.facebook.com/bluedtaiwan/photos/a.431071483684440/1135252383266343/?type=3"
